{
  "$schema": "https://json-schema.org/draft/2020-12/schema",
  "title": "Evidence Handling Posture",
  "version": "0.1",
  "type": "object",
  "required": [
    "posture_registry_id",
    "version",
    "status",
    "postures",
    "boundary_note"
  ],
  "properties": {
    "posture_registry_id": {
      "type": "string"
    },
    "version": {
      "type": "string"
    },
    "status": {
      "type": "string",
      "enum": [
        "draft",
        "active",
        "deprecated",
        "superseded"
      ]
    },
    "postures": {
      "type": "array",
      "minItems": 1,
      "items": {
        "type": "object",
        "required": [
          "evidence_status",
          "handling_posture",
          "runtime_response",
          "allowed_claim_behavior",
          "blocked_claim_behavior",
          "recommended_next_action",
          "boundary_note"
        ],
        "properties": {
          "evidence_status": {
            "type": "string",
            "enum": [
              "pending",
              "cited",
              "supported",
              "contested",
              "insufficient",
              "missing",
              "stale",
              "superseded"
            ]
          },
          "handling_posture": {
            "type": "string",
            "enum": [
              "signal_incomplete_evidence",
              "allow_citation_reference_block_support_claim",
              "allow_scoped_support_claim",
              "require_conflict_review",
              "block_support_claim",
              "surface_gap_and_block_support_claim",
              "require_renewal_review",
              "retire_current_authority_preserve_audit"
            ]
          },
          "runtime_response": {
            "type": "array",
            "minItems": 1,
            "items": {
              "type": "string",
              "enum": [
                "allow_semantic_validation",
                "allow_citation_presence",
                "allow_scoped_support_claim",
                "block_support_claim",
                "block_universalization",
                "surface_warning",
                "surface_evidence_gap",
                "surface_conflict",
                "require_source_collection",
                "require_support_review",
                "require_claim_to_source_fit_review",
                "require_conflict_review",
                "require_renewal_review",
                "request_updated_evidence",
                "preserve_audit_trail",
                "retire_current_authority",
                "point_to_newer_controlling_evidence",
                "continue_with_limitation"
              ]
            }
          },
          "allowed_claim_behavior": {
            "type": "array",
            "minItems": 1,
            "items": {
              "type": "string"
            }
          },
          "blocked_claim_behavior": {
            "type": "array",
            "minItems": 1,
            "items": {
              "type": "string"
            }
          },
          "recommended_next_action": {
            "type": "string",
            "enum": [
              "continue",
              "cite_sources",
              "review_support",
              "resolve_conflict",
              "supply_missing_evidence",
              "renew_stale_evidence",
              "retire_superseded_evidence",
              "block_support_claim",
              "unknown"
            ]
          },
          "friction_level": {
            "type": "string",
            "enum": [
              "none",
              "low",
              "medium",
              "high",
              "block"
            ]
          },
          "review_required": {
            "type": "boolean"
          },
          "human_review_required": {
            "type": "boolean"
          },
          "audit_required": {
            "type": "boolean"
          },
          "renewal_required": {
            "type": "boolean"
          },
          "retirement_required": {
            "type": "boolean"
          },
          "escalation_note": {
            "type": "string"
          },
          "boundary_note": {
            "type": "string"
          }
        },
        "additionalProperties": false
      }
    },
    "anti_collapse_rules": {
      "type": "array",
      "items": {
        "type": "string"
      }
    },
    "methodology_ref": {
      "type": "string"
    },
    "vendor_scan_ref": {
      "type": "string"
    },
    "boundary_note": {
      "type": "string"
    }
  },
  "additionalProperties": false
}